tweets,class
stupidgreedy ppl vote 4 birdhater smart ppl votesmart will romney outperform obama again via,-1
romney supporter wears racist antiobama tshirt to campaign event via,0
romney campaign downplays poll giving obama advantage among early voters the hill topprogs ctl p2,0
obama policy only kills off businesses like sensata forcing jobs overseas romney career has saved hundreds of thousands of jobs,0
why do i have a funny feeling romney is going to win come november 6th,-1
fox host challenges hardly nonpartisan studies romney cites to defend tax plan,0
townhall format could pose challenge for romney realclearpolitics via,-1
i see mitt romney is a used car salesman and trust him about as much,1
romney just gave a hell of a speech in lebanon ohio he's really hitting his stride romneyryan2012,1
please bring it up and make romney laugh like a nut,1
spikeup 'romney' up 4833 hour,0
watch live obama and romney face off in debate,0
bob dyer romney pays own freight in the falls ohio romney = leadership character accountability tcot,1
ppl with a romney bumper sticker made me wanna punch them in the eye lol,-1
lol if romney becomes president everyone with a funny namelike me u and u is gonna not like it,-1
sesame street is protesting against romney,0
hopefully and also how scandal is a romney fam affair son tagg stole from medicaid with scooter company scam,-1
romney and bain hard at work and saving people's jobs vs o and the choom gang hardly working,0
mormon belief is quite a read romney you believe this,0
koch bros use their company to round up votes for romney their key investment kochexposed dem tcot ohpoli p2,0
politics thousands gather to support romneyryan in ohio tcot teaparty p2,0
as election day nears romney crowds are surging,0
obama keeps small lead on romney debate bleeding stemmed poll washington reuters president barack obama r,0
mitt romney a pig,0
rt if you wish romney luck,0
hmm romneycancels on the view i bet he did they are a apart of the 47,0
romney helping others works only if you don't count all the times he didn't because he could make a buck,0
so searching completely wrong on google images yields pics of romney mylifeismade,0
i can't deal with this romneysupporter on the bus talking about how mexico should be the 51st state so we can steal their resources,0
he's also sitting on a story out of hawaii on obama's birth certificatesome maybe twice,0
funny irony hilarious photoshopped movie posters featuring mitt romney via,0
bands will make her dance stamps will make her twerk if romney becomes president all these hoes will have to work,1
breaking in blow to obama romney endorsement by ross perot means 61 of perot's immediate family now out of reach for obama experts say,0
please dear god landslide vote romney,0
bill galston on why wisconsin could be the key to a romney victory,0
most christian pastors supportromney for president newsiglesia,0
how the gop destroyed its moderates and ended up with romney as its candidate by greatread,-1
joy behar and regis philbin on romneys decision to cancel his view appearance via,0
president barackand mitt romney debate in a rap battle [video],0
three michigan newspapers endorse mitt romney mitt2012 tcot gop teaparty tiot noapology endorsemitt,0
mitt romney wants gay people to have equal rights and opportunities but he doesn't want them to marry someone explain that bullshit to me,0
can't help this stupid is as stupid does forest gump poll romney near landslide in rural swing counties,-1
smart man no thanks romney bails on 'view' appearance via,-1
i found a site with all the details mitt romney's 5 trillion tax plan it's as simple as clicking a button,-1
i had a dream it came out that mitt romney was a closet homo truth freedom,-1
polls rt so romney is now leading in new poles,-1
obama vs romney,0
charts of barack obama and mitt romney inder says romney,0
even if romney wins without a conservative senate we won't repeal obamacare lnyhbt,0
romney sees 'growing crescendo of enthusiasm' across battleground states abc news,0
watching the obama vs romney debate soon can't wait but my eyes are slowly closing,0
usa election=new poll 49 peoples want to see obama as winner 46 peoples back romney,0
lol yes yes yes you and romney can get,0
didn't romney graduate from harvard,0
bands will make her dance stamps will make her twerk if romney becomes president all these hoes will have to work,1
america be afraid the young are voting and they're like totally voting for romney cause he's like hot,0
romney to release 2011 tax return this week topix,0
oh no we cant let romney win hell let lobbyists in the white house via,-1
the crowds romney is getting is outstanding obama is signing up every hispanic that just turned 18 but wont shut up about the middle class,0
what a little town in illinois can tell us about mitt romney's america via,1
just saw some kid laughing hysterically while opening an envelope full of romney bumper stickers goodthings,0
romney has my vote big bird creeps me out and it's so much easier to not care about 47 of the population my kind of president sarcasm,-1
i put my money on gov romney,0
patton oswalt gives romney debate tips on conan video,0
des moines register ross perot endorses romney for president,0
when it comes to his 5 trillion tax plan don't let mitt romney give you the runaround details matter,-1
let me read that again because i did not see anything that involves romneyryan supportingthis,0
ny1 decision 2012 obama romney take on policy in second debate nyc,0
i predict a withering offense from romney and bho giggles stutters or both,0
romney's foreign policy aptitude is his weaknesshis ineptitude would start more warsnot end them,0
romney and baincapital scandal could be brewing sensata outsourcing,-1
romney says he'd have the race locked up if he was latino rosie perez stabs him in the heart smileandtwist,0
where the polls stand ahead of debate 2 as president obama and gop presidential nominee mitt romney ready for,0
i'll be at the 50000a plate dinner for mitt romney in little rock tonight sure hope i get to keep the plate,1
romneyryan2012 tell gov romney god speed,0
perhaps he could debate romney & win,0
why do u allow obama to tape his ads in or at the white house it is against campaigning rules to use the wh in ads,0
i'm seeing too many romney signschile boo dnt worry shoot i'm scared lol,0
mitt romney is a dick,0
rt catching mitt romney in the flipflop he won't enact antiabortion legis will just cut allprochoice funding,-1
did you read at the end that the author of the book the show was based on is supporting romney,0
editorial paints a bleak picture of what could happen to abortion rights should romney get elected,0
apple meets tree===tagg romney's company misled reporters about its relationship with ponzi schemelinked firm,-1
romneyryan2012 fans plz prepare yourselves for a vicious obama this coming tues debatea he'll come back like a cornered animal be ready,1
photoset hempstead ny obamaromney 2nd debate,0
ross perot endorses it is time for a new beginning it is time for mitt romney romneyryan2012,0
in 1965 mitt romney wasarrested for using large blocks of ice to slide down the slopes of a golf course tfm,0
in 1965 mitt romney was arrested for using large blocks of ice to slide down the slopes of a golf course i want that 4 prezz,1
the navy seal that was killedbest friend said romney introduced himself to glenn 3in a 30minute spanhe didn't recognized him,0
mitt romney is a relentless baldfaced liar a sociopath a thing without a conscious the devil,0
romney better appreciate my vote this little guy was not easy to get,0
matt taibbi mitt romney campaign 'not serious' via,0
we are sliding back into full blown recession mitt romney will have the obama recession to manage and he will reverse course,1
especially like how romney wasn't a popular governor amongst ma democrats new york times the moderate mitt myth,0
romney says he will cut out loopholes which ones doesn't say,-1
mayans were right if romney wins ive been saying that ever since i found out he was running,0
watch ann romney blasts obama for sore loser 'poor sportsmanship' tcot war resist44 gop lnyhbt twisters p2,0
romney who honey boo boo backs obama at just 7yearsold alana honey boo boo thompson can't actual plz rt,-1
someone needs to give mr romney the moniker country club president and explain the meaning,-1
9 things that show mitt romney is morally bankrupt alternet,0
romney will win tell it here and vote,0
romney foreign affairs romneyryan2012 potus gop dnc paulryanvp romney2012 romneyoh cuyahogagop,0
mit romney stylegoromney,0
that news reporter or whatever she is lightweight irritated me forreal calling romney's wife the first lady,0
y'all romney will be our president in 500 hours,0
man it is not denver's night so far fire the groundskeeper i sound like mitt romney eh lol,-1
manchurianmitt is the real mitt romney sensata globaltechappliances tcot,0
romney responded that he was unable to fit it into his schedule really the future generation is what matters most,0
hey gop send me a hundred grand and i will tweet vote romney every day until the election is over dm for email,0
think of romneyryan as an arranged marriage ryan came with quite a dowry but romney pays a price,-1
fuck romney obama for america,-1
there are three types of lies lies damn lies and mitt romney obama2012 cnn nowwithalex ohiostate p2 unions vets,0
tribune newspaper officially endorsed mitt romney for president via 2012election,0
had a reese's for breakfast and i will soon be in the same room as mittens romney and brobama today is a good day,0
so the creator of friday night lights wants romney to quit saying clear eyes but the writer of the books which it's based endorses rr,0
mitt romney flops so fast people get hit by the shrapnel,-1
hearing romney brag about slavelike conditions that chinese workers seem happy with our millionaire seems even less of a full human being,-1
the debate tonight is going to be like hopkins and stony brookand romney is hopkins,0
romney wants to turn medicareinto voucher system my parents had that back in the day during ssr n it sucked a lot noforromney rt,0
are you going to believe me or your own lying eyes ann romney blames media negative for husband's image,-1
romney doesnt share our priorities or our values theres too much at stake to let him take us backward obama12,-1
gallup 2012 tracking poll mitt romney 49 barack obama 47 lv; october 814,0
matt taibbi romneyryan tax plan still makes no sense,0
boots on the ground say fl shifting towards leaning romney and maine no longer solid now ca polls going south,0
women push romney [rma] into lead,0
you and lindsay lohan are endorsing romney but for different reasons i hope teamobamabiden,0
obama and romney,0
romney's stake in chinese stocks via sensata,0
election2012 choose originalist judges maybe appointed by romney v activist judges surely 2 b appoingted by obama tcot teaparty,1
mitt romney was a lay bishop in the mormon church how did i not know this nydebate,0
obama claims that america is lazy and that is why he's lost over 24 million jobs mitt romney actually takes credit for jobs hecreates,0
paul ryan's myths during the debate mitt romney's tax plan on romney's evolution and more,0
holy crap mitt will say anything while rove kochs and others tell him wat to do why romney toys with truth,0
romney thought voters or a percentage of them are idiots so he threw a 20 tax cut bone fox,-1
mitt romney probably watching hip hop awards right now thinking ain't none of them niggas going to vote for me,0
just watched a video on what romney thinks about women's health care bastard,0
romney is a retard lol,0
hahha your a prime example your so ignorant i love it you and obama are so much alike and i don't like romney ethier thanks,0
newtone rt former obama czar calls romney 'douche' on cnn via,0
mitt romney avoided military service by seeking & receiving 4 draft deferments yet was early supporter of vietnam war,0
romney line for debate while i was creating jobs 4 ordinary americans at bain my opponent was creating jobs 4 wright & ayers tcot,0
at last romney's tax plan explained,0
awk moment when you read a comment about romney and you laugh out loud in class lol icant,0
charities would see gifts shrink under romneys tax ideas via,0
i wonder if romney will share any specifics on his tax plan tonight,0
opinion obama and romney deadlocked in virginia nbc4 washington blog,0
tyt left out one important reason trisha is voting romney mitt rhymes with tit that could sway some votes,0
oh they are going to the polls & voting for romney at least the ones i know,0
old guy was standing alone on the side of rt 9 the other day waving a romneyryan sign and shouting to traffic lonelyguy,-1
obama question since u think romney is bad because he made millions in business how did u become a millionaire as a community organizer,0
supporter at romney event likely a liberal plant via,0
rt has revealed all the details of his tax plan on a new site,0
chasing the reagan legacy mitt romney and paul ryan like so many republicans today continually try to grab on,0
romney confirms that his former bain partner was an al qaeda operative just kidding i wanted to lie like mitt to see how it feels,0
dear new york what makes the city beautiful wall street main street and jobs vote romneyryan for jobs and prosperity,0
romneys six studies validating tax math face growing scrutiny tpmdc,-1
offensive 'put the white back in the white house' shirt spotted at romneyrally somebody's race card's showin,0
live blog obama & romney's town hall debate,0
romney + 9219 points beats obama so far in 25trends elections 2012 analyses debate tcot p2 sensata,0
koch brothers go all in on romneyryan econ mises keynes,0
lol at romneyists who rear end obama supporter cars bc they couldn't see them down the road with their headlights off,0
dear friends who plan to vote for romneyi can't invite you to my wedding if i'm not allowed to have one,0
romney tax plan website dems punk gop platform with via,0
media make unsupported claim romney supporter wore racist tshirt at rally via,0
i found a site with all the details on mitt romney's 5 trillion tax plan it's as simple as clicking a button,-1
romney will show americans the light at the end of the tunnel tomorrow nightdebate mittromney,0
watch 2012 presidential debates obama needs knockout president obama faces mitt romney for the second debate,0
obama's story romney's story and the truth previewing tonight's big debate obama,0
the cable company should give me a rebate for even making me listen to romney speak at all,-1
i wanted them to explain how romney would benefit them and niether could but kept accusing black people of only supporting,1
romney dumps sensata stock to his charity to avoid tax in 2011 returns,0
key to lowinformation voters obama simply needs to invite voters to see that romney the product will,0
if you're a women this is why you should vote democrat election2012 obama romney republican gop tcot rr2012,-1
plz flw luke skywalker romney is a 'snake loadingslideshow lukeskywalker mittromney ronpaul,-1
even fox had to admit the math of romney's tax plan doesn't work no problem bc gop voters don't care about facts or math mitt knows this,-1
according to the irs big bird's net worth is actually 50 greater than mitt romney's tcot,0
broken promises romney's massachusetts record via,0
romney changing positions more then a exsperienced hooker,-1
poll obama romney tied in new hampshire,0
who cares about romney when there's kian ;,0
the workers protesting on the ground at the sensata plant are saying that the romney campaign has called the cops on them,0
bandz a make her dance stamps a make her twerk but if mitt romney becomes president you hoes gone have to work,1
romney's bain helped philip morris find a new generation of replacement smokers,1
let president obama finish what he started dontletromneybushitup,-1
time to close rt fl poll finds a razor tight race mitt romney leads 4948 a 5 point improvement for him compared to 3 weeks ago,0
there are romneyryan yard signs in every yard up and down my street it's awesome exactly how it should be,0
it's unbelievable to me that sensata isn't trending yet i've noticed so many tweets about the subject goteamsensata bain romney,0
on eve on second debate romney on the rise cbs news the guardian on eve on second debate romney on the rise,0
mitt romney and paul ryan will save america from the socialistic policiies of the democratic party that r destroying future of our country,0
george romney aide on mitt romney it seems that mitt would say and do anything to closealor an election,1
death threats against mitt romney proliferate via,-1
if the empty suit called romney had guts he would decry voter suppression & rail against koch bros employee coercion,-1
openly racist romney supporter not much more needs to be said,1
tru mitt romney so u wouldnt let ur kiids go to school,-1
the similarity between ios purists and mitt romney mobile technology,0
romneylooked great in last debate and ryan did great with facts last week,0
even fox news doesnt buy romneys six studies on tax policy via,0
swing states poll women push romney into lead via,0
i just purchased romney r longsleeved tshirt from tcot my little way of showing support,1
marlboro mitt latest attack on romney links him to plan pushing cigarettes on kids tv news,-1
mitt romney's jobs plan math is as bogus as his tax plan math p2,0
fuck is romney talking about raising taxes for bitch we already paying 109 for a small ass bag of chips full of air,0
good morning ready for gov romney to kick some charlatan's ass tonight debate2012 tcot nope2012,1
short axelrod we spent millions of dollars explaining who romney is to the voters then he rudely denied our description at the debate,0
just got out of church preaching politics what the i should vote for mitt romney since when did the church start telling me how to vote,-1
clarity & leadership listen mitt romney full foreign policy speech hope is not a strategy youtube,1
no way rt study secret donors significantly fueling proromney tv ads,0
ready for the obama romney presidential debate round 2,0
shocking pay attention ya'll rt romney supporter wears shocking racist tshirt to campaign event,0
prophetic poll says romney will win presidency via,0
if romneywin we all fucked,0
excellent description rt mitt romney is a human sand castle reshaped by every incoming tide,1
vote romneybecause piers's gut says so,0
interactive website makes fun of romneys tax plan,0
what does it take to get discredited in dc failed iraq neocon dan senor dictating romney's foreign policy,-1
ifromney become pres y'all think he gone rid of perms,0
taxes charity cost romney 579 percent of income via,0
seven psychopaths you're skipping romney's comeuppance tomorrow night to watch old recordings of the gop primary debates,0
president clinton explains mitt romney's 5 trillion tax cut via,0
romney is a big idiot obama deserves to win this ; he's amazing3and i don't even live in america xd,0
debatepredictions the only chance obama attack romney he has nothing on his record notice he didn't mention obamacare at all at dnc,1
romney is now +4 with gallup lv great result,0
do they have another capsule that we can throw romney and ryan into send them on their way minus the parachutesredbullstratos,-1
any woman that votes for romneyryan in my opinion needs her head examinedthese men obviously believe women are second class citizens,-1
you can help romney turn around the usa by contributing,1
voting 4 romney,0
romney has quite the tax plan going on,1
yes while romney and ryan are working the rush isstill trying to find his,0
bill clinton breaks down mitt romney's tax plan 'illusion' for obama campaign video via,0
romney's tax plan finally revealed campaign2012 romney2012 obama2012,0
mitt romney had to practice sitting on a stool for tonight's debate i kid you not,0
totally got into a political debate on fb w some middle aged man who kept spewing racism and nonsense facts as to why he supports romney,-1
so mitt romney is ahead right now 259 obama 261 romney it's going to come down to ohio from what the polls sayholy shit,0
romney just doesn't feel right he doesn't look like he should be our president,0
another question for mitt romney i know paul ryan thinks highly of the author ayn rand why do you feel ryan will be good for the 100,0
real stakes in the hofstra hoedown on what day and time will obama and romney speak at their party's 2016 convention if at all,0
katy butler asks president and romney to wear purple as spirit day app,0
oped columnist death by ideology despite what mitt romney says the lack of health insurance does kill people,-1
mitt romney is one of the greatest and most irresponsible debt creators of all time must read,0
koch brothers to workers vote for romney or else,0
mitt romney does it for the ratchets,0
fuck romney randomtweet x l,0
romney rolls onto debate stage in heelies does finger guns fakes handshakesmoothes hair across temples economy recovers immediately,-1
romney may bring up his bipartisan record in ma tonight the realromney doesn't think it's a good idea,0
according to the new york times romney still stands to profit off of the sensata outsourcing read more at sensata,0
have a look on how romney can cut taxes whithout raising other ones ;,-1
yo can you hook me up with romney's birth certificate i'm not sure he's a legitimate candidate,-1
robbin' hoodarmed robbery and redistribution in the age of obama tcot teaparty lnyhbt romneyryan2012 p2,0
sensata is so sad but it just reinforces what we already knew about romney thanks for reposting,0
bonanza romneyraises 170 million in september guy benson via,0
debate aftermath romney hammers biden on libya remark breaking news popular,-1
if u google image search completely wrong a page full of romney pics pop upcoincidence,0
wow they are idiots i have been a ceo of nonprofits for 25 yrs & tell you they will lose funding over this but romney don't care,0
stayrt i stole a mitt romney sign that was my good deed for the day,0
for all the details on mitt romney's trillion dollar tax plan visit,0
umm excuses are rt its not j's fault c what had happen was mitt romney smirk,0
obama romney hunker down for debate prep abc news abc newsobama romney hunker down for debate prepabc newsp,0
obama campaign turns to bill clinton once again with new web ad explaining how romney's tax plan doesn't add up,0
obama prolly called romney and said i don't see how you can hate from the outside the white house you can't even get in hahaha leggoo,0
why is romney's facebook page on my feed no i will not like your page so stop asking,0
what about romneystax records invest in america oh except for romney fuck u both,0
president will be 'more energetic' in second debate but romney campaign says romney,0
obama is doing his best trying to clean up this country go ahead vote for romney bet your taxes will double,-1
sadly we lost it debate and i cant understand romney taxes conflict of interest w trigg nation,0
romney buffoonery ryan oblivion in economy matters no way jose,0
tweet mittlies every time you hear romney lie tonight topprog dems obama2012 p2 p2b connecttheleft,-1
hates mitt romneyloves,0
bands will make her dance stamps will make her twerk if romney becomes president these hoes will have to work,1
kochs vote romney or 'suffer the consequences' as a contentious election season enters its final weeks a flur,0
mt mitt romney's bain helped philip morris make us high schoolers look awesome,1
romney is not a great debater either he is just good lying obama needs to really show up,0
so if romney gets elected r u going to pay my taxes when they go up,0
this is romney's main argument to fix the economy presidentialdebate,0
we call that pulling a romney in my household,0
another crappy slanted story where romney's statements against environmental regulation go unchallenged,-1
this is probably romneys best polling day of this election,0
for romney america is up for sale to the highest bidder china for now sensata voteobama,0
opinion obama check romney's facts van jones says president obama should tell voters the facts about social secu,0
or in his best ricardo montalban voice my old friend rt i think romney should start calling obama cupcake,0
wishing mitt romney the best of luck tonight take obama to the cleaners careerpolitician,1
romney white house would immediately face marriage issue,0
i hope that monkey look a like obama don't win romney12,0
why no advertising during mlb games obama seems to be spending millions in this area,0
in 1965 mitt romney was arrested for using large blocks of ice to slide down the slopes of a golf course romneyforpresident,0
worldnews news what's fueling romney's climb up the polls the gop candidate has seen an increase in his poll,0
do you like mitt romney's tax plan copolitics,0
if barack loses the debate tmrw though romney winning and if romney win i'm moving to ghana,0
romney is winning the battle for women by,0
romney consultant at center of gop voter registration fraud scandal still working for gop in 10 states freakoutnation,0
new david corn video helps expose romney's ties to terrifying rightwing fanatics via,0
rosie perez slams romney it would be helpful to be latino comment while mitt romneys 47 percent remark b,0
romneys unraveling claim that six studies validate his tax plan via,0
no 1 politician is perfect but do they serve the one who is perfect prayer politics election2012 obama romney god jesus,0
on after axelrod planted lead in romney hit peice day before debate to setup weakened obama; biased obama2012 tcot,0
wait did she just call romney and ryan smart,-1
romney foreign policy speech shows hes not ready 2 be commanderinchief p2,0
please read my latest blog rt what romney needs to do to stay ahead 2012elections tcot ycot,0
