tweets,class
romneyryan finally give a succinct explanation of their tax plan,1
threats of sacking much scarier in the usa with no public healthcare and romney snapping at the presidency serfdom pw12,-1
this month carp sent me a membership form and linkedin wants me to follow mitt romney what about me says old man republican,0
i predict pain for mr romney tonight he can't lie his way out of this setting,-1
the electoral map is flipping for romney rural voters flocking to the gop candidate b,1
this just in my crazy uncle who lives in the attic just endorsed mitt romney,0
teed off an early morning thought illustration enjoy your days writing etc romney,0
we join in prayer for mitt tonight may god find us faithful,1
what mass repubs think of romney rt romneys 800 vetoes shatter his bipartisan myth,-1
the gop ad that will send romney to the white house,1
for all the details on mitt romney's 5 trillion tax plan visit,0
i thought women hated romney,0
from weekly standard ross perot endorses romney,1
kos has to be sputtering w rage romney hits 50 leads by 4 in pppdaily kos national poll tcot debate2012,0
i uploaded a video what mitt romney should do in the second debate,0
rt this just in my crazy uncle who lives in the attic just endorsed mitt romney &lt;&lt; ross perot is your uncle,0
crowleycnn a q rarely asked whats mitt's view of 30m uninsured other than letting states decide &amp; wht if he were governor,-1
mitt doesn't know nor care who stacey dash is the bodyguard bruhahhhaha see that's what you get dionne,0
we have 3 weeks to park in fl and tell these seniors that romney voucher care will mean having to reverse mortgage your home,-1
daily kos mitt romney's nightmare bill clinton explains mitt romney math via,-1
smshow i am soooo happy the romney tax plan has been cleared up hilarious,-1
7 key states move toward romney on new rove electoral map via,1
rosie perez rips mitt romney video,-1
chuck todd were seeing a structural change in the race toward romney hot air via,0
raised right campaignbutton romney government,1
does this make ann romney,0
perot for romney well that was fast just two weeks ago ross perot was refusing to endorse either romney,1
via poll romney has large lead in rural swing counties,1
jaredwatkins romney explains tax plan somebody at the dnc learned javascript,-1
bands will make huh dance foodstamps will make her twerk but romney taken em' so that bitch gotta' workk,0
romney plans 11 mil ad towards women will it work are women falling for it,0
aww the nigga voting for romney,0
rt 21 days until election day ppl lets make sure we vote romney,1
we may advance slowly with bo but mitt will make us slide into a catastrophe only worst to great depression devastation &amp; rule by d rich,-1
news roundup romney ahead in key swing states salt lake tribune blog,1
adam levin why romney the closer is a consumer nightmare politicians often have a lazy relationship with the t,0
took long enough finally some details on mitt romney's tax plan,0
scott lilly would romney really kill big bird,0
had a dream that i was in a car with mitt romney,1
people agree with mitt on 47 he should have drove it home not puss out with the media,1
ryan falsely denies romney plan to raise defense spending 2 trillion via,0
stopspinning romney losing in swing states,-1
is mitt romney a stepdad he cares about you because he has no choice 47percent,-1
funny when it comes to his 5 trillion tax plan don't let mitt romney give you the runaround details matter,-1
for all the details on mitt romney's 5 trillion dollar tax plan visit,0
just asked a rep at my college something only to get the most vague answer i have ever received in my life it was like listening to romney,-1
47percent this just in my crazy uncle who lives in the attic just endorsed mitt romney,0
same in virginia not alot of bho sign's but a hell of a lot for romney,1
romney takes the lead in florida the plank on blog florida,1
unacceptable koch brothers urge employees to vote for romneyor else,-1
scary 5 disturbing stories that reveal the real mitt romney,-1
romney tax plan details are here edshow,0
the good news is i'm way to tired for the debate tonight so you guys won't have to listen to me rant about how horrible romney is,-1
gun toting bitter bible clingers are racist pigs poll romney rolling among swing state bitter clingers 59 37,-1
mitt romney took his state from 36th to 47th in job creation left with a 38 approval rating &amp; didn't run again bc he had no chance to win,-1
i know this girl does not have on a romney sweatshirt,0
tonight's presidential debate can't wait should be great want to see what mitt and bo have to say,0
romney gaining in pa tcot tlot sgp lnyhbt gop p2 lnyhbt,1
pray for another romney big win in debate today,1
mitt romney + bain = job outsourcing pioneers 2012uselections,-1
romney tax plan get the details,0
mitt romney i hate you get off my pandora,-1
russia launches antismoking crackdown against mitt romney's russia tobacco business,-1
it will be interesting to see how romney connects to voters without offering any answers or solutions nydebate,-1
messina2012 romney's out of touch view on the uninsured helps build that 'wrong for the 47' narrative,-1
all the details you need to know about the romney tax plan,0
how paul ryan would bring romney's taxes to zero,-1
mitt is gunna put the nail in the coffin tonight,1
heeeee rt breaking details on the romney tax plan revealed,0
what mitt romney should do in the second debate via,0
romney &amp; the seven right wing radicals in romneyland debate 47percent tcot p2 ohsen vasen pfla nhgop,-1
you'd think it would be a big story that the plan that forms the entire basis for romney's candidacy has been revealed as bogus,-1
i really hate that romney is using fridaynightlights' most famous quotetagline for his own ugh can we stop that,-1
i enjoy seeing which people like mitt romney on facebook so i can laugh laugh laugh like biden,-1
there is a romney we should all listen to and it's not romney cult park,-1
2 funnyreallyromney cringed wthat endorsement,-1
today is tuesday october 16 2012 and the romneyryan tax plan is still mathematically impossible,-1
romney is the nwo pick for 2012 presidency alex ansary,1
the details have finally been released for the romney tax plan,0
perot backs romney citing 'unsustainable course' former presidential candidate ross perot came out in favor of,1
ross perot endorses mitt romney,1
good luck tonight mitt,1
rt scary 5 disturbing stories that reveal the real mitt romney,-1
hey wonder why mitt doesn't use his first name willard maybe cuz you think of rats,-1
when you vote for romney you're also voting for this is this really the type of american you are,-1
i really hate that some of my evangelical and pentecostal friends are contorting mormonism in order to vote for romney,-1
retweetnevada attn sportsmen us tax payers help the unemployed vote romney,1
check this out and pass aroundthe romney tax plan finally released,0
romney for a win,1
awesome go here for a hilarious take on romney's 'evasive' tax plan,-1
stacey dash supports mitt romney he proceeds to call her ms houston and tell her he liked her in 'the bodyguard',0
taibbi romney ryan tax plan should be slaughtered by the press what's math,-1
whoa all the details on romney tax plan tx,0
vote no on myth romney and the mormon takeover of america p2 tcot christian,-1
ross perot endorses mitt romney tcot resist44 gop2012 teaparty,1
romney holds advantage tonight regardless of format realclearpolitics writer by my friend mark salter,1
i sit staring this thing with bush reagan no problem mittbad vibesdeceit will sell us out 4,-1
more than 500 economists 5 nobel laureates back romneys economic strategy,1
did you know these celebs are romney endorsers 7 is a supermodel sp,1
mitt romney isn't a business genius just a speculator who played &amp; won big a rigged market,-1
check this out and pass around the romney tax plan finally released,0
romneyryan terror to the old sick and poor shud be attested,-1
suicide watch romney hits 50,-1
rt stacey dash supports mitt romney he proceeds to call her ms houston and tell her he liked her in 'the bodyguard',0
have you seen this romney camp admits their jobs plan is complete bs at,-1
news roundup romney administration to welcome lobbyists,-1
you see elway supports romney yea he's a tool,-1
is finally what we've been waiting to hear from the romney campaign exactly what i expected p2,0
a good read about commonly used estate planning and tax strategies used by mitt romney,0
but right for the chinese mitt romney is wrong for women gays and the middle class pointblankperiod,-1
guys romney's first memory of ann is throwing rocks at her and her horse this is my new favorite fact,-1
romneyryan tax cut,0
waitdid mitt romney actually mistake stacey dash for whitney houston y'all lying this can't be real lmao,-1
simce the last debateyeslol romney just says what the people want to hear in the end he will screw them i have a feeling,-1
mitt romney often away when he was governor,-1
as romney repeats trade message bain maintains china ties is this who u want in the wh america,-1
dear my friends who had abortions and are now voting for romney that's called 'pulling the ladder up behind you' and it's not very nice,-1
romney won't face 'the view' yahoo news via,-1
but do not background check o racist disingenuous rt scary 5 disturbing stories that reveal the real mitt romney,-1
great video by photographer ann romney talks to the morning call video,0
mitt criticized by his father's longtime aide,-1
not a fan of trump or mittromney ;,-1
the secretary of explaining sht unwraps huge tax cut for millionaires like him and mittromney,0
fck romney and fck republicans altogether lolyou gotta get the fck romney tshirt at go,-1
want to know how mitt romney's 5 trillion tax plan adds up simply click here,0
romney will make reusable coffee devices illegal waronmugs,-1
well i'll say it no romney did not win the first debate liars don't win debates sensata,-1
google this paul ryan mitt romney gay photoshop,0
waystogetshot vote for mitt romney,-1
lt romney,1
noticed that 2 neighbors bho signs 'were missing' after the weekend hummdestroyed probably my romney sign is 10 days old,1
video would romney have it easier as a latino breaks it down at,0
romney the business man,0
koch brothers to workers vote for romney or 'suffer the consequences',0
go to for the details of romneyryan's tax plan p2 tcot,0
i have no respect for mitt romney,-1
swing states poll women push romney into lead,1
please rt please don't elect romney,-1
mitt romneys handson leadership style micromanager or chief decider the ticket yahoo news via,0
mitt romney you're only here for our amusement how do you mistake stacy dash for whitney houston,-1
rossperot endorses romney,1
mitt romney's career of shipping american jobs all over the world mitt romneyryan2012 mitt romney4china sensata p2,-1
romney campaign up with two new tv ads in wisconsin via,0
dispiriting to see righty journalists devoting less time to scrutinizing romney's plans than to debunking others' scrutiny of them,0
smh rt stacey dash supports mitt romney he proceeds to call her ms houston and tell her he liked her in 'the bodyguard',0
romney is a used car salesman trying to sell us a clunker with no carfax trustme nowarranty onlydrivenonsundaysbyliloldlady p2,-1
that's funny fantastic finally get the details of the romney tax plan here,0
black people always singing that rick ross song rich forever if mitt romney win yo ass gone be rich alright ;,0
my suggestion for mitt america ever seen a mugshot with someone wearing my face on their shirtdrops mic loosens tie,0
im fucking w mitt tomorrow doe i wanna talk to him and see his face bc ima look and smell different lol higherpowerhighgrade lmao,0
please don't elect romney,-1
ross perot endorses romney finally thanks ross,1
the thing w slick willie's hill 'buck stops here' statement is it might shore up the moderate democrat base from bailing over to romney,-1
finally romneyryan tax plan explained in easy terms check it out p2 47percent,0
are you in israel and a romney supporter looking to fill a slot in a segment at 1130am get in touch cc,0
for me the race card is so played out romney is successful because he had a good education and he worked,1
shocking said no one the morning plum romneys jobs plan revealed to be flimflam,-1
a virginia doubledip for romney running mate with close presidential election undecided,0
nyt [under a romney scotus] the basic right to abortion might well not survive,0
icyminote on ohio pollswhy party id in polls is worse than you think and why romney's independent lead is a big deal,0
rt dispiriting to see righty journalists devoting less time to scrutinizing romney's plans than to debunking others',0
arithmetic over illusion mitt romney's nightmare bill clinton explains mitt romney math,-1
cleanpots mt you'd think it'd be a big story that entire basis for romney's candidacy has been revealed as bogus,-1
rt presebate nyts covers or o on libya wapo on jobs tipping o's hand tho giving romney 12 hours to ready responses,0
can we ask one questionmaybe romney wud site vp compas an issue thebank gets bailed out and he makes millions,-1
morningjoe romney ryan campaign should make a large contribution to the soup kitchen,-1
mitt romney claims he'll create 12 million jobs in his ad but the wash post gives it 4 pinocchios factsmatter,-1
mitt romney and paul ryan are serious men for serious times no doubt about it,1
idonthavetimefor the people at bainport says mitt romneyi'm making too much money by outsourcing their jobs sensata,-1
how romney will reduce deficit cutting total 6 hrs defense spending hint big bird may be armed,0
the national memo president clinton explains how mitt romney is planning huge tax breaks for millionaires,0
ross perot endorses mitt romney washington times via,1
obvious i do not denigrate stepdads this is how ind voters used a caricature to characterize romney for a pollster,0
lol rt well played dnc rt new details on the romney tax plan,-1
sad snake oil salesman doing well with the gullible via poll romney has large lead in rural swing counties,-1
romney perhaps i should debate hillary tonight apparently she wears the pants in this administration tcot emptychair romneyryan2012,0
mitt romney is wrong for women gays and the middle class pointblankperiod,-1
romney cancels appearance on the viewgood for him they are so bias he would never have a chance americans know this disgraceful liberals,1
mitt romeny all dayy eerr daayy,1
mr potus get in there tonight and townhaul a foot off in mitt's ass,-1
whoever tried pulling off the romney 2012 sticker i have on my car i will find you and i will kill you,1
romney treating ohio as a mustwin state cincinnati ohio romney seems to have gained an extr politics,0
keeping them honest anderson cooper rips mitt romney's tax plan video via,-1
praying fasting 4 usa others doing same &amp; family praying on knees blessings mittromney wont fail,1
ten million of those jobs in romneys plan represent an entirely bogus promise,-1
a coal stock that could soar with a romney win thestreet via,0
poll romney near landslide in rural swing counties romney fox nation,1
townhallquestions why are you calling romney a liar when that honor belongs to you gibbs carney rice etc,1
mrdpnt god bless america rt 21 rap lyrics mitt romney can use in tonight's debate,0
mitt romney is a relentless baldfaced liar a sociopath a thing without a conscious the devil,-1
if romney wins me and are moving to india and were gonna wear headdresses,-1
cu professors doubledown on prediction of romney win due to economic factors,-1
rt&gt; gop hopes soar as romney rolls in ohio tcot,1
ryan fakes helping at a soup kitchen appropriate given the fake help the romneyryan campaign want to give the poor and middle class,-1
for a detailed explanation of how the romneyryan tax plan works people are so creative,0
how will mitt romney's mathematically impossible tax plan work the pesky details are just a click away detailsmatter,0
tears &gt; rt 21 rap lyrics mitt romney can use in tonight's debate,0
wi gop jazzed about romney's prospects despite bad polls by who covered the protests in 2011,0
here you are with the moderator of tonights debate talking smack about mitt,0
rt rosie perez mocks mitt romney's 'it would be helpful to be latino' comment in new video,-1
the coming romney boom mona charen national review online,0
this made me chuckle a lot romney tax plan details,-1
romney holds advantage tonight regardless of format realclearpolitics,1
road up here was lined with luxury suvs laden with romney stickers,1
sounds reasonable romneyryan tax plan,1
in 1965 mitt romney was arrested for using large blocks of ice to slide down the slopes of a golf course,-1
the moderate mitt myth,-1
rt scary 5 disturbing stories that reveal the real mitt romney,-1
i'm entitling my presidential election persuasive essay would the real mitt romney please stand up,0
9 things that show mitt romney is morally bankrupt alternet sensata,-1
romney rakes in staggering amount of money from lobbyists,-1
mitt romney don't pay no tax mitt romney don't pay no tax,-1
those women who have switched alliance 2 romney after his lies in 1st debate if u really exist i have a bridge in b'klyn 2 sell you,-1
endorses for oscar nomination jg reportedly to play george romney in major studio film on american motors,0
mitt romney is a relentless baldfaced liar a sociopath a thing without a conscious the devil,-1
romneyryan tax plan finally get the elusive details you need to know,0
five disturbing stories that reveal the real mitt via,-1
romney pumped 40m into his own campaign in 08 and who knows this time around,-1
matt taibbi the romneyryan tax plan should be laughed at the raw story,-1
romney's tax plan is on tumblr too,0
huntsman's 3dimensional path to the presidency in 2016 romney must lose works for me jonhuntsman2016,-1
thanks to women romney leads by 4 points in swing states and here is our aunty,1
and what type of logic is this cunningham from a blk man lol im voting for romney cause his people,1
uh oh nbc chuck todd says theres been a structural shift in the polls toward romney,0
why blacks voters reject romney via,-1
president clinton explains the arithmetic behind mitt romney's 5 trillion tax cut doesntaddup election2012,0
details on how romney's going to give millionaires a 5 trillion tax cut without making the middle class pay lol fb,0
get a fck romney shirtthat way you can tell em how you really feel order one at lol,-1
romney gaining in pa,0
great news we finally have details of romney's tax plan bad news the details of romney's tax plan,-1
wouldn't be surprised as i believe romney stole that rose on the bedroom pillow story i don't believe george romney did that bs,0
mitt romney you'll never find a more rechid hive of scum and villainyyou must be cautiousthis november election2012,-1
ron paul won't endorse romney says more of same yahoo finance via,-1
mitt will be wearing invisible surgical gloves you people will be way too close,-1
bands will make her dance stamps will make her twerk if romney becomes president these hoes will have to work,0
soooo epic romney romneyryan romney2012 wherearethedetails,0
romney tax plan website finally lays out all his tax plan details,0
must see &gt; for all the details on mitt romney's 5 trillion dollar tax plan visit,0
spy fading isn't working well seems market is pricing in a romney dbate win,1
we just find it puzzling that romney agreed to personally utter these words wo asking more s about the math,-1
mitt's budget plan is magic just like all the gop plans in the last 30 years clinton debunked the myths at the dnc debate,-1
under one electoral scenario we could be looking at a romneybiden administration,0
i look at this and i think the same thing as romney we are weak &amp; need another 1 trillion in defense spending,0
you are an albino now what can you see i have no doubt that mitt will do really well tonight we'll all be watching,0
romney i love teachers i love pell grants i love american workers i love pbs by the way you're all fired sensata debate,-1
'mitt romney wrong for women's health' obama2012,-1
wonder how mitt romney's mathematically impossible 5 trillion tax plan adds up it's as simple as clicking a button,-1
romney's 5 trillion tax plan visit tax plan revealed study up before the debate tonight dems,0
finally an easy to understand website about romney's tax plan p2,0
america2012shalom from fernandina romney,0
mitt we wish you to have a winning debate tonight,1
release mitt mitt and the gop 2740 emails from stratfor second release gifiles,0
did you have this spread when you got to work this morning didn't t merlin olsen field at romney stadium,0
if romney become president we all gone have to start reading the terms &amp; conditions we might fuck around &amp; be agreeing to slavery,-1
rosie perez asks mitt romney easier as a latino actually,0
even fox news calls bs on six 'studies' cited by romneyryan to bolster their 5 trillion tax cut scheme,-1
poll women boost romney 5 in 12 swing states via,1
mitt romney trying to visit hbcu schools aintnobodygottimeforthat,0
is this why romney won't talk to sensata workers whose jobs are being shipped to china,-1
mitt romney was born rich i can't vote for a nigga that never ate ramen noodles,-1
lol mt go tigers short of romney killing and eating a kitten live onstage my vote is set,0
democrats launch ingenious new site to attack romney's tax plan via,-1
rt rt scary 5 disturbing stories that reveal the real mitt romney,-1
mittromney does not concentrate on voter racial groups mittromney concentrates on 100 of the people he does not pander &amp; promise,1
the difference between romney and ryan on the 47 is that romney doesn't even pretend to give a shit soupkitchen,-1
romney ads still pushing the us versus them 47 line recovery not dependency classwar nothelpful,0
rt romney rakes in staggering amount of money from lobbyists &lt; he's got romneymentum,-1
bain sensata chinese flags over america soil healthcare enforcing basic human needs at the state level under romney's plan,-1
a romney presidency poses a threat to women's health and reproductive rights,-1
drudge tagg romney fall for fake romney endorsement from fake jake gyllenhaal [oops] when outspokenly liberal actor jake,-1
i hope romney dont win,-1
as i recallross perot not that fond of the auto industry either probably agreed with romney to let detroit usa crash &amp; burn,-1
here we go rt romney rakes in staggering amount of money from lobbyists,-1
ncpol copols rt romney's bogus claims about his jobs plan did glenn hubbard sign off on this,-1
romney surrogate giuliani admits gop is exploiting libya incident for political gain disgustingfail p2,-1
romneys new math 4 his jobs plan doesnt add up people can't be naive enough to believe what these guys r selling,-1
no more taking care of the disable and getting a nursing home federal note check mitt romney only signs checks for mormon cult leaders,-1
mitt hides his financeshard drives in mass as govyou can only evaluate him on his actionshe outsources jobs,-1
expect mitt to say i'm sorry but he's just not being accurate or variations many many times tonight go get 'em mitt with style &amp; grace,0
oooooh grea doesnt romney just have the best endorsers trump perot and todd akin sort of kinda makes you sick,-1
the winds of change are all evident in the american elections it is almost certain that mitt romney will win the race for the white house,1
romney campaign did not respond to groups asking about plan to combat child poverty according to jansingco,-1
big bird responds to mitt romney,0
finally some romney math that actually adds up romney america = twoface gotham election2012,-1
snoop said reason he's not voting for romney the niggas name is romney lololololololol,-1
the studies the romney camp itself cites in defense of the plan dont back up the plans promises suckit romney,-1
this &gt;&gt; wapost factchecker studies romney cites in defense of his tax plan dont back up plans promises p2 tcot,0
aye make u guys tune in on tonites debateromney's supporters increase tenfold after the last debate so they dam near necktoneck,1
wow rt stacey dash supports mitt romney he proceeds to call her ms houston and tell her he liked her in 'the bodyguard',-1
new from jmg new site romney's tax plan go ahead click for details,0
muito bom romney tax plan website finally lays out all his tax plan details,0
south florida's greatest downfall because it's fill with richretired old folks that means it's also filled with romneyryan supporters,-1
it's who new gop romney are not all republicans are like lyin' ryan &amp; trump via,0
this really disgusts me ryan romney,-1
i think crowley will go off the reservation and reinterpret questions against instruction despite that i expect romney to win,1
&gt;&gt; no but i do think romney is cheating should be against law 2want2 make tax policy &amp; hide his taxes,-1
in play romney draws to within 4 in pa teaparty tcot resist44,1
history teacher is talking about how he has sent mitt romney some packets over the yearsbut he never got back to himjeez i wonder why,0
benjamin disraeli's 3 types of lies lies damn lies and statistics romneyryan redefining the lie debate2012,-1
david stockman mitt romney and the bain drain via,0
lol this determines how racist romney might really be the 2nd presidential debate between,-1
oh never mind i just hear an interview on npr with a woman who changed her vote to romney based on how attractive he looked at debate 1,-1
for the details on romney's tax plan go here,0
townhallquestions mr romney how does it feel 2 b intellectually superior 2 ur opponent do u evr feel sorry 4 him,0
romney won't do any better,-1
obots threaten to kill romney if he's elected u s politics,0
