tweets,class
insidiousmitt romney's bain helped philip morris get us high schoolers hooked on cigarettes via,-1
you mean like romney cheated in primary,-1
mitt romney still doesn't believe that we have a black president,-1
romney's tax plan deserves a 2nd look because he has a secret one that's different than the one he's been lying about,-1
hope romney debate prepped w the same people as last time,1
want to know how mitt romney is going to be able to cut by 5 trillon dollars go here it explains everything,-1
if romney wins the presidential election the worlds really ending this year,-1
romney's 12 million jobs scam reminds me of rip torn selling pennies in the movies sick puppy,-1
mitt romney said that catching osama bin laden would be insignificant and it's not worth moving heaven and earth,-1
please be mitt romney who is honey boo boo endorsing for president video,0
romney is disappointed when states allow samesex marriage,-1
if women that the polls show are truly voting for romney then i don't want to know how they truly take care of their household's,0
when it comes 2 his 5 trillion tax plan don't let mitt romney give u the runaround details matter,-1
mt reminder mitt romney isn't changing positions he's refusing to admit the positions he has,-1
ppl know romney is a liar he hides his taxes makes false accusations agnst women rights yet they buy into it cant bleivemakesnosense1,-1
good luck tonight i have already voted for you nothing obama says could change my mind i see what he has done actions speak,1
mitt romney is seriously thick listen to him for 5 minutes i fear for the world,-1
the debate tonight is going to be pointless we all know romney will win the debate once again,1
democrats launch ingenious new site to attack romney's tax plan brilliant p2 tlot tcot,-1
mitt romney always worshiped his father this must hurt at least a little,0
hope the debate goes as well for romney tonight as it did the first time around but with hair like that how could it not,1
fuck mitt romney rick ross voice,-1
romney can kiss my ass,-1
yet another ceo asks employees to vote romney for yet another ceo asks employees to vote romney for sake of th,-1
radio ad mitt romney completely wrong via,-1
if you're a woman voting for romney you either have a penis an iq of 5 or are close minded as hell responsestomonicacrowley,-1
good one dnc but more importantly romney didn't think to snatch up this domain,-1
if i were the yankees i'd send arod to debate romney &amp; start barack obama at 3rd base hey it's not like either of them can get any worse,0
if bo comes out 'fighting' mitt will simply take advantage of the obvious pressure on the president,1
romney isn't clueless he's evil,-1
romney could his make his second fortune in teaching other people how to lie as effortlessly as he does,-1
shocker romney jobs plan revealed to be flimflam p2 p2b democrat hofstra,-1
where are these polls showing romney ahead i never see them,-1
boom rt former romney senior aide says romney will say and do anything to close a deal,-1
fox news is really struggling to defend romney &amp; ryan oh &amp; who is this chick did she really say that on national tv,-1
oh yeah rt romney i pray to baby jesus you assault obama with an ak47 tonight god bless,0
can u tell which candidate you support romney i hope,1
romney picking up steam now has 1 of black vote atleastitsnot0,-1
patton oswalt gives romney debate tips on conan video,0
ann might try a mirror ann romney blames media negative ads for husband's image stopit thisishard romneyshambles,-1
dear misinformed public romney does not only propose some minor tax cuts but major cutting of government spending romneyryan2012,-1
mitt romney's jobs plan math is as bogus as his tax plan math,-1
reported mitt romney's sponsored shit as spam on facebook,-1
snoop doggs reasons not to vote for romney this muthafuckas name is mitt hes a morman but he aint got no hoes,-1
george bush said mitt romney will be a great president are people really respecting his opinion,0
romney may have been in other townhalls but never when 100 get to ask questions and hear answers kingofcrazytown,-1
business insider please explain why bill clinton is wrong on romney ryan fraud,-1
poll romney opens large lead in rural swing counties,1
fantastic letter tony dungy wrote to president obama &amp; mitt romney about the importance of fatherhood to our countryrt,0
fun fact mitt romney would become the first man to be elected president after telling half the country to fuck themselvesandy borowitz,-1
more so than most politicians i have no idea how anyone believes anything romney says,-1
in politics you get what you deserve if women don't vote you get romney think it over vote or shutup,-1
i'm not saying you're a liar gov romney i just approve of ads saying so oh and ads that say your a murderer politedebate,-1
romney is attacked by his father's longtime aide p2 election2012,-1
i suspect the mainstream media of being bought off by big billionaires to skewer the polls and fix the reportingromney is rising too fast,-1
s exactly frum urges romney to show empathy with the audience the one thing he'll struggle to do,-1
mitt romney,0
i'm moving to paris if romney wins,-1
mitt romney's jobs plan math is as bogus as his tax plan math washington post factchecker glenn kessler takes,-1
mitt romney's plan for a middle class tax cut would provide zero benefits to 739 percent of the middle class,-1
thingstoremember romney has not submitted relevant tax records whereareyourtaxrecords mitt,-1
mitt rommney aint pay no tax,-1
as i've been speculating the secret to romney's tax plan is that he's not all that committed to the promised 20 cut,-1
this is an impressive web experience romney's 5 trillion tax plan details matter,-1
he should maintain his grace and let his persona come through respectfullybut challenge romney on the facts and specifics,0
missing from romney's tax plan reality fortune blog fortune blogmissing from romney's tax plan realityf,-1
lt and it's nothing against romney i just feel like they should be paying more attention if they're trying to truly cater to their users,0
mitt romney don't pay no tax,-1
rt why mitt romney's 12 million jobs math is rejected by the fact checkers,-1
women gop mitt romney does not support your right to get equal wages for equal work &amp; that is your economy &amp; also your retirement no mitt,-1
im like really in love with romney,1
itspartytimechumps mitt romney,0
romney must feel on debate days like i did at sats just pray i can make up for math problems by acing the verbal,-1
if romney wins y'all gonn be popping kids out like crazy,-1
do not feel bad for bush if pigs fly and romney wins bush will be celebrated by the gop and robme expect him 2 get awards,-1
mitt we don't have people dying for lack of health insurance mitt talk to a healthcare professional not gop toadies and learn we do,-1
snbc romney is not a strong debater romney is strong liar,-1
wow if you're a woman who votes romney you're a fucking idiot it's like a jew voting for hitler,-1
if romney becomes president you can catch me living in mexico fuck that,-1
rt fun fact mitt romney would become the first man to be elected president after telling half the country to fuck themselves debate,-1
if people r stupid enough to vote 4 romney because they believe the bullshit he spews then we are in trouble america big trouble debate,-1
he's a black republican that believes in mitt romney does that make him a racist,0
the romney endorsed ryan plan would put pressure on american seniors in a way we have never seen before the,-1
when romney tells you that he doesn't control the super pac slush fund he is lying most of these ppl are mormons,-1
mitt stands for nothing but making the rich richer while putting all the stressand dis advantage on the working claas&amp;poor simple,-1
i don't know but thank god he is willing to take on the challenge and get america back to greatness mitt romney is america,1
if romney become president we better start reading the terms and conditions because we might sign and agree to slavery,-1
reagan's budget director 'mitt romney was not a businessman',-1
i have a hard time believing the poll numbers how can a racist like romney be ahead,-1
america seriously if you vote romney in you deserve everything that follows but the rest of the world doesn't,-1
mitt romney fix this mess i know you can step on necessary toes plug the holes stop the bleeding you get the pic just make it happen,1
theweek i would ask romney to stop lying and for once tell the truth debate,-1
in that city you will thank god you never had anything to do with roman romney and his one world order jesustweeters tcot tworship,-1
if romney become president we all gone have to start reading the terms &amp; conditions we might fuck around &amp; be agreeing to slavery,-1
ina26 lmfao i'm trying it's just that they're talking about romney now,0
mitt romney can suck my dick &amp; if you a republican oh,-1
mitt romney won't be elected because as much as lifelong republican voters don't want to admit it they don't trust or like him sorry mitt,-1
when romney says we're going to take back america which america south america central america north america election2012,-1
dmorrissey that's also significant considering romney still has 200 million in the bank with 3 weeks left,0
why people who care about vietnam vets should never ever vote for mitt romney,-1
romney will definitely try another 'trick tonight probably bring flowers for all the women questioners,-1
everybody in my office voting for romney i should quit huhyea,-1
don't even shake romney's hand just say nah dude nah and shake your head as if disgusted rotfl,-1
with a romney in office we would be in 5 wars right now iraq afghanistan lybia benghazi &amp; iran does that even make sense,-1
i'm feeling sick to my stomach just pondering what will happen if romney if elected just based off his supporters backwards rt,-1
dont be fooled if you are part of the middle class u will pay more under a romney presidency new taxes fees or deductions will affect u,-1
so essentially romney's trying to buy the presidency,-1
mitt romney campaign busted buying hundreds of thousands of facebook likes and twitter followers via,-1
mitt romney's 5 footlong now served with a side of bullshit,-1
fuck mitt romney,-1
romney is no buster douglas,0
they say figures will not lie but liers will figuressounds like romney &amp; rynn programs yep 4+3=9 it just that simple,-1
i change my mind i hope romney wins,1
romney is fucked up for wanting sesame street gonethey live in the hood and one of em even lives in a trashcanthey living rough ijs,-1
romney plan doesn't add up deserves second look headline laughable sign of the times,-1
if romney really wants to win the postdebate analysis he should come out for better pay for focus groups,0
romney is such a racist easier as a latino actually,-1
mitt romney's new jobs math just doesn't add up see why,-1
romney secret plans 2 create 12m job is just not true instead we ll loose more than 12m job with his 20 tax cut 4 wealthy,-1
my guess is romney tonight will preemptively call obama a liar like he did the last time in order to cloud the truth during the debate,-1
docchannel no i cringe when romney speaks he is repugnant to me a criminal in candidate's clothing,-1
romney is an idiot,-1
why mitt romney's 12 million jobs math is rejected by the fact checkers,-1
romneyi thank you for your low paying life on the line in the coal minesand i will make sure you do not have healthcare,-1
women who want to vote for romney i don't understand,-1
surprise surprise romney's new tax plan for jobs does not add up romneyryan2012 fail,-1
romney's tax plan doesn't add upbut it deserves a second look,-1
i cannot for the life of me figure out why any women are voting for romney is there something i am missing,-1
what we've been waiting for mitt romney's tax plan adds up to a tax hike for the middle class here's the math,-1
77 really is as if he is not a criminal i mean just the fact that statehood is supported by romney smh,-1
stacyolson7 no thanks romney has my vote,1
romney enjoys abortion profits tax returns reveal investments in stem cell research plan b chinese oil prolife,-1
romney's jobs numbers are cobbled together from various reports on existing policies and trends that have nothing to do wromney's plans,-1
mitt will be fine he has the truth on his side,1
rt if you want to play a debate drinking game where you dont get drunk drink every time romney,0
romney's 12 million jobs pledge is based on completely bogus math,-1
romney he is this type of dick he published my personal aged pictures,0
romney can't even name 3 ramen noodle flavors he don't know the struggle fucromney,-1
i much prefer bombastic furiously insulting absurdly based papers like why krugman is but a little twerp or wanted romney's brain,-1
romney central jobs argument exposed as fraudulent via p2,-1
romney's grandpa was a pimp lol he had 5 wives &amp; 30 kids he was a busy man,-1
he will control your every moveromney drafted bill to allowing religious grp to ban gay's from adopting children,-1
if romney win i'm no longer wearing nice clothes or driving a nissan i'm downgrading to a kia &amp; wearing colombia &amp; wrangler jeans idc idc,-1
romney named walid phares radical islamophobe tied to militia that committed atrocities to his foreign policy team,-1
in 1965 mitt romney was arrested for using large blocks of ice to slide down the slopes of a golf course he's going to hell,-1
mittromney is a relentless baldfaced liar a sociopath a thing without a conscious the devil,-1
chuck ok i'll be here keeping count of mitt's lies if it take 140 tweets lol,-1
this is funny when it comes to his 5 trillion tax plan don't let mitt romney give you the runaround details matter,-1
mitt romney said that catching bin laden would be insignificant and it's not worth moving heaven and earth,-1
i have no doubt that mitt will do really well tonight we'll all be watching mittromney cannot wait rommeyryan2012,1
fuck romney like i really don't like him his bitch ass he don't kno the struggle,-1
seriously the arithmetic issues in the romney campaign are epic this analysis of his jobs numbers is just brutal,-1
mitt romney is fake bro romney's 12 million jobs is fake,-1
diane von furstenberg is not quite sure how ann romney ended up wearing one of her dresses,0
adwatch mitt romney is wrong for women's health radioattackad von ppvotes warnt frauen vor romney uswahl,-1
cat then call me sexist; i'm voting against romney because he's a dick,-1
vidjwhite858 mitt will suck tonight because he will be around you peoplemittastrophe,-1
romney's tax plan doesn't add up but does it deserve a second look,-1
mutt romney how about no viagra or early prostate exam untilled men are 60 come on ain't that fair,-1
cnn mitt romney made millions investing in companies that did business in iran,-1
romney has a record of cutting jobs cutting pay &amp; cutting pension but don't worry america he won't do that to you sensata,-1
the new york times mr romney needs a working calculator,-1
o the lohan effect will romney get a boost from lowinformation voters via already there,-1
sorry mitt in the real world tax reform doesn't boost growth bruce bartlett writes today that a romneysty,-1
if romneyryan wins i'm moving to canada or britain,-1
don't worry romney's plans will fail on their own merits arapgov13,-1
davidlimbaugh been praying all day for an even better showing for romney,-1
exactly rt beginning to suspect this mitt romney character is as imaginary as his tax and health care plans,-1
love that mitt romney has sponsored his page on facebook so i can see who likes it i just unfriended five people thanks mitt,-1
mitt romney is using immigration as a pinata after twisting himself into a xenophobic pretzel,-1
rt 'mitt romney wrong for women's health' obama2012,-1
townhallquestions mr president you broke many of your 2008 promises why should we believe you'll honor them now btw i'm voting romney,1
mitt romney lied about his dad's walkout via,-1
that is because romney's plan if there is one would be the same as newt's let them get jobs as janitors asshatsabide,-1
facts in 1965 mitt romney was arrested for using large blocks of ice to slide down the slopes of a golf course plain stupid,-1
hmmm every time i try to click the get the details link on romney's tax plan it runs away as if trying to hide,-1
mitt romney don't pay no taxmitt romney don't pay no tax,-1
y barackobama we cannot afford 4 years of mitt romney will be back to the bush days,-1
politics poll romney has large lead in rural swing counties by howard berkesnational public radiooctobe tcot,1
missing from romney's tax plan reality fortune blog fortune blogmissing from romney's tax decision2012,-1
romney plan doesn't raise middle class taxes 012 tcot,1
let me get this str8 everyone knows mitt romney is a pathological liar but it's up to the potus to show everyone what they already know,-1
35 reasons youre an idiot if you dont vote for romney don't show this to liberals we already know they're idiots,1
dumb broad talking about how mitt romney is going to help her dad pay less in taxes i'm going to choke someone,-1
america needs a strong leader not one who hides behind a woman america needs mitt romney,1
all this talk about mitt romney's 5 trillion tax i know you want change but i only have 100 bills,-1
could mitt romney walk in your shoes,0
if romney wins it's going back to slavery lmao,-1
ann romney like vacations too but she won't take them on our dime,-1
mitt criticized by his fathers longtime aide,-1
super pac man romney is gobble up economics spokesman for right wing ideologues they want all the money,-1
great news we finally have details of romney's tax plan bad news the details of romney's tax plan,-1
taboout12 that's terrific we have to keep trying i am hoping for a romney landslide 21 days till election day and i can't wait,1
bill clinton explias liar romney's tax scam in full,-1
in june romney told employers to tell employees how to vote; now theyre doing just that,-1
if u like romney u will b deleted and blocked,-1
romney did not make his positions clear in the debate he side stepped issues supreme court justices make the decisions,-1
and if romney gets in we are definitely goin to bomb iransmdh,-1
mitt romney lied about his dads walkout,-1
when it comes to his 5 trillion tax plan don't let mitt romney give you the runaround details matter,-1
why romney the closer is a consumer nightmare via,-1
romney's solution to childhood poverty borrow money from your parents,-1
in case you missed this maddow show romney is attacked by his father's longtime aide via,-1
economy expected to create 12m jobs by 2016 romney brags his plan creates 12m jobs interesting kinda like cleaning an already clean pot,-1
i have no doubt that mitt will do really well tonight we'll all be watching agreed,1
romney is a vulture capitalist who destroyed jobs and lives;pioneered outsourcing of american jobs; has off shore accounts n pays no fed tax,-1
mitt romney corporations are people my friend sensata,-1
what a fake i will not vote for romney ryan ticket edshow,-1
rt curious if romney's tax plan could work we crunched the numbers find out the answer romney,-1
mitt romney cancels 'the view' appearance via because he might be asked to tell the truth foreign to him,-1
moderate mitt myth romney no principles just the desire to be president at any cost undecidedvoters,-1
if romneywins and roe v wade goes we know from our own countrys preroe history the brutal consequences,-1
hypa says mitt romney is wrong for america wrong for our troops,-1
bwah rt one throwaway comment by romney in may rush limbaugh whitewashes mitt romney's extremism,-1
romney'tax cut plan does not add up,-1
daily kos mitt romney's jobs plan math is as bogus as his tax plan math via,-1
fewer qualms for gunrights groups over romney now,0
longtime george romney aide attacks mitt basically this confirms that mitt romney is full of shit via,-1
romney's reforms will only be suppression,-1
paul ryan too good to help needy exactly what romneyryan would be like in white house wake the fuck up only care abt themselvesromney,-1
romney closer to latinos in florida specially cubans miami whitehouse obama,0
paul ryan washing already clean dishes to fool america represents the romneyryan ticket fake and phoney to it's core,-1
father of murdered us ambassador to romney leave my kid alone,-1
did romney get a hitler hiarcut today,-1
romney's busy first day in office,0
the news in this waiting room is saying that romney is getting ahead in the polls with the female votewtf is wrong with those women,-1
governor romney's budget would make the hunger games a reality,-1
ten million of those jobs in romneys plan represent an entirely bogus promise,-1
romney's bogus claims about his jobs plan did glenn hubbard sign off on this cc,-1
republican consultant robert traynham says on msnbc that romney has a moderate record severely,0
tonight mitt romney's debate plans include a healthy dose of ropeadope somebody please provide the dope with enough rope to hang himself,-1
failures in romneys economic proposals postitive externalities i am a fan of free markets,-1
no more liars in the white house vote romney ryan,1
rural america wants to think real hard on voting for a lier flipflopper&amp; jobs killer romney has shipped jobs overseas while at bain corp,-1
i would like to know how i got on pretty much every romney email list ever made,0
you can tell when romney is lying watch how he swallows hard when he lies very telling,-1
mitt could outspend the president 10 times if he wanted to,0
romney transfers 12m to nrscnrcc which can't coordinate w him + 32m to 4 state parties which he hopes will,0
romney's 12 million jobs pledge based on totally bogus math via,-1
missing from romney's tax plan reality even under the most generous economic assumptions mitt romney's tax pl,-1
romney momentum translating into electoral gains via,0
kuddos to howard dean romney doesn't care about the issues he wants to be president well put,-1
mitt tryna be a hitler,-1
mitt romney wrong for women's health' obama2012,-1
chardlui see richard next time don't cut your guest off when he's telling the truth about mitt's way of governing,0
mitt romney just like die fucking hell no one likes you,-1
nathome i sure hope mitt is ready for his next job as a greeter at wal mart,-1
governor howard dean romney doesn't care about having a plan he just wants to be president he's running a hocuspocus campaign,-1
two degrees from harvard and romney still can't be honest about what will happen when millionaires get another tax break mittmath,-1
i will cry if romney becomes president and takes away birth control; keeping us from getting pregnant isnt the only use for it,-1
ill haha fantastic they have some brilliant mitt romney ones too btw yes ive been in paris since july staying 18 months or so,0
scene from the wh this morning what i really am debating govvromney again eff me i thought it was all just a bad dream,-1
if romney become president we better start reading the terms and conditions to stuffbecause we might sign and agree to slavery,-1
romneyis attacked by his fathers longtime aide,-1
the romneyryan ticket is antichoice naral prochoice america video masen p2 mapoli tcot,-1
mittmeleon changing colors on the fly on stage at debates2012,-1
romney you wasn't with us eating romen noodles in the projects bitch you dont no the struggle voteobama,-1
romney probably has a tiny dick,-1
how come romney brings up green cards &amp; immigration when a hispanic asks a question racist ass,-1
what is your point in repeating irreverent shit over again obviously romneydoesnt understand what the definition of a straight answer,-1
the romney has lied and his policies won't work sketchydeal debates factsmatter,-1
did romney just say he wants to give all our jobs to foreigners with a degree how would that help us out debate,-1
romney won't be able to accomplish one thing as president if he can't even explain his plan thoroughly as a candidate,-1
having a career is important to meromney says college grads don't have jobs yet i had 3 offers prior to me graduating,-1
the only reason the unemployment rate is low because too many people have already lost their jobs romney dumb assthat made no sense,-1
romney is not as on his game,-1
romney is so shady its ridiculous he has no convictions about anything,-1
romney no one cares cause you also have immigrants working at your house in massachusettes,-1
mit romney just contradicted his self,-1
romneyi like mexicans as long as they came here on a private jet,-1
everybody knows romney is lying he's a walking contradiction,-1
never forget that the middle class does not exist for romney,-1
i just realized romney looks like mr fantastic from the fantastic four not related to anything but i may have an idea for a reboot,0
romney is promising a bunch of crap that i'll doubt will ever happen,-1
romney is writing off the latino vote this is purely for his base,-1
i agree 100 with romney's immigration policy get in line bitches get in line,1
finally romney said sum shit i like,1
romney fucken up immigration letitbe,-1
it took mitt 3 tries to get lorraine's name right deaf jerk,-1
romney is tremendous repeat he is trying to stay on his feet with the same jabs,-1
romney i have a question for you are you personally better off now than four years ago,0
kidding meromney makes nosense on this immigration topic,-1
it's romney's time now he's standing strong love it when he talks so much sense,1
romney looks like a cartoon character,-1
yuck would romney stop the bs hand jesters we know which way down is,-1
just answer the damn question romney obamawinning,-1
hahah well said romney if they're smart and have a diploma give em a green card,1
fuck romney,-1
