tweets,class
wow rt mitt romney called stacey dash ms houston lol then said i loved you in the bodyguard yesimjudging,0
yall better vote for barack obama 4 realif yall love yall jobs and the taxes they take out nowif romney win its getting worst,1
if gallup is accurate then voters are really stupid or misinformed mitt romney lied to them in last debate &amp; they fell for it,-1
wondering how romneys going to give millionaires a 5 trillion tax cut without making the middle class pay for it,0
mitt romney is a relentless baldfaced liar a sociopath a thing without a conscious the devil,-1
who know hu wil win us election hop for mitt romney,0
i predict pain for mr romney tonight he can't lie his way out of this setting,-1
the 2nd presidential debate between president obama &amp; gov romney begins tonight at 9 pm debate topic domestic &amp; foreign policy headsup,0
wonder how mitt romney's mathematically impossible 5 trillion tax plan adds up it's as simple as clicking a button,-1
today is tuesday october 16 2012 and the romneyryan tax plan is still mathematically impossible,-1
mitt romney is a relentless baldfaced liar a sociopath a thing without a conscious the devil,-1
mitt wants the votes if he wins the caring will vanish just like all his smoke n mirrors job creation plans for america,-1
swing state tracking obama 49 romney 47,0
check out romneyryan tax planpass aroundlol,-1
you'd think it would be a big story that the plan that forms the entire basis for romney's candidacy has been revealed as bogus,0
you'd think it would be a big story that the plan that forms the entire basis for romney's candidacy has been revealed as bogus,-1
no one will convince anyone with a functioning brain that 20 million women switched to romney in 7 days media hoax,-1
if you're in college voting for romney you're an ignorant moron tbt,-1
mitt romney exposed deeply linked with nwo conspiracy ghw bush and 911 documentary by john hankey,-1
romney is the nwo pick for 2012 presidency alex ansary,-1
my crazy uncle who lives in the attic just endorsed mitt romney wow he must love that attic,0
actresses call out romney on abortion in new ad gop latism dnc tcot p2,-1
chuck mitt lacks content that is a big problem voters don't know where he wants to take the country,-1
the secretary of explaining sht unwraps huge tax cut for millionaires like him and mitt,0
wsj helps romney campaign float dishonest debate tactic on health care reform,-1
romney i love teachers i love pell grants i love american workers i love pbs by the way you're all fired sensata debate,-1
well i'll say it no romney did not win the first debate liars don't win debates sensata,-1
god will be with you tonight mitt you'll be great go get 'em we need you,1
mitt criticized by his father's longtime aide,-1
if we can win this second presidential debate then nothing's gonna stop romney tcot oh pa nh,1
ross perot endorses mitt romney and absolutely destroys obama,0
rt&gt; i am so proud of 16 yr old karri protesting for her mom's job mitt romney should be ashamed of himself,-1
rt details romney plans doesn't give the specific that are required,-1
thoughts on rasmussen showing obama up,-1
ironically mitt does his own shopping and may know prices milk is 399 bread 299,0
why is absolutely nobody threatening to leave the us if romney wins justasking,-1
why voters view romney as the step dad,-1
grant are you also behind romney's factual lies campaign it stimulates debate but is odious &amp; crass,-1
romney perhaps i should debate hillary tonight apparently she wears the pants in this administration tcot emptychair romneyryan2012,0
for me the race card is so played out romney is successful because he had a good education and he worked,1
i don't think it's right romney has millions in off shore accounts so he doesnt have to pay taxes shrugs,-1
romney rakes in staggering amount of money from lobbyists,0
if the president is not reelected; hold onto your blankets bc u might end up living on the cold hard streets thanks to mitt;,-1
did romney erase the tweet to stacey i don't see it,0
how will mitt romney's mathematically impossible tax plan work the pesky details are just a click away detailsmatter,-1
from an i'm all for america mitt standpoint even if it was failing why not come in revitalize it and save american jobs,-1
rt a new survey of rural voters shows romney leads obama by a wide margin 59 percent to 37 percent,1
why blacks voters reject romney,-1
romney tax plan website finally lays out all his tax plan details,0
the romney plan is just a shift to cause more failing american families less growth on the economy for the middle class and poor,-1
uh oh nbc chuck todd says theres been a structural shift in the polls toward romney,0
they open that i'm voting for romney,1
ron paul won't endorse romney says more of same yahoo finance via,-1
a friend of mine who is egay and make 30000 a year is for mitt romney wtf,1
'mitt romney wrong for women's health' obama2012,-1
romney's big job plan one big fat lie check it p2,-1
you know you're in a boulder county school when a romney d comes on pandora and the whole class laughs,-1
sticks to who your mitt like youto have and you'lland we'll see the diffrence again polls still show together we will go far,1
you need to go to fox you are so in the tank for romneyyou hammered ben and glazed over ryan in the kitchen being fake,0
rtromney rakes in staggering amount of money from lobbyists jammedia,-1
romney's solution to childhood poverty borrow money from your parents,0
wow this week's daily kosseiuppp national poll finds mitt romney leading barack obama 5046,1
mittnopoly the game mitt romney plays with the middleclass ncpol,-1
what are the odds that mitt will cry like a little bitch during the debate the con pundits have already started,-1
romney will do anything for a buck,0
mitt romney lies constantly hides his tax returns has contempt for 47 of americans yet the race is close doesn't make sense,-1
rt mitt romney sent a thank you letter to stacy dash and addressed her as whitney houston stopthemadness,0
if you're watching the us election debate tonight follow for detached independent analysis of how far obama has won by,0
this is critical and romney walks away speaks volumes,-1
washington post fact checker mitt romney's 'new math' for jobs plan doesn't add up,-1
with 100 of crazy atticdwelling uncles reporting we can confirm that mitt romney is favored to win by a wide margin,1
rt great news we finally have details of romney's tax plan bad news the details of romney's tax plan,-1
will you be wearing one of your suits that you have made in china seems appropriate for supporting mitt sensata,0
why folks vote for mitt who is going to take us back to pre fdr &amp; make women 2nd class citizens help me out here sensata,-1
romney i see his smile is fake promises empty his lies long i have no hate or bias clouding my mind or blinding me,-1
ryan your budget will do more harm to the poor all you and mitt want is to say the numbers damn that these are people w real needs,-1
i had a dream mitt romney won oh hell no,-1
study says most dont believe retractions so romney gets credit 4 retractions but we dont believe 'em,1
romneyryan plan cuts outreach programs for sexually assaulted children while increasing subsides 4 prisons,-1
well it sure as hell aint romney he's mormon,-1
hey ohio pa detroit &amp; others remember who saved the auto industry and thousands of jobs it is president obama not mitt romney,1
romneyryan plan cuts outreach programs for sexually assaulted children while increasing subsides 4 prisons,1
finally details on how the romney tax plan works,0
it's obvious romney has something 2 hide in his taxreturns profits by offshoring xfer to charity then tak deduction,-1
awh yea romney goes on offense forcing obama to defend record,1
romney can't even name 3 ramen noodle flavors he don't know the struggle fucromney,0
rt celebbuzz us presidential race a look at ann romneys campaign style gallery being ff love bones sex,0
mitt romney defends tax return secrecy by falsely claiming he's been as open as president obama romneyryan2012 p2,-1
piers morgan for mitt cnn star says romney'might just save america' via,0
economists believe romney's economic plan will take us into recession; at best +87k jobs not 12m at worst 600k,-1
making stuff up to satisfy your students constituents would be emulating romney,-1
mitt romney today received the endorsement of former independent presidential candidate and deficit spending hawk ross perot tcot,1
the electoral map is flipping for romney,0
washington post investigates romney's jobs plan finds zero us jobs plus a chinese factory surrounded by barbed wire,-1
yes and yes do you have another question maybe about how romney wants tax cuts for his friends paid for by us,-1
the washington post reviews romney's new math on jobs gives it four pinocchio's,0
debateday the washington post reviews romney's new math on jobs gives it four pinocchios,-1
for tonite how can americans trust romney positions when his staff quietly takes back what he claims he stands for,-1
the washington post reviews romney's new math on jobs gives it four pinocchios,-1
swing state poll women push romney into lead,1
woman you may not be sure if romney is your reliable father or caring husband but whatever you want him debates,1
a peek behind the romney campaign wizard's curtain reveals four pinocchios for a misleading jobs plan,-1
and obviously this is much worse than romney politicizing said american deaths to try and get points with the public yeah ok,-1
romney's tax cut &amp; spend plan is a rehash of bushcheney it harms the middle class while enriching the 1 p2 tcot,-1
ryan &amp; mitt you were asked today to address povertybut you declined why both of you use the poor as stump speak and that's all stop it,-1
mitt for women signs yesterday as ann spoke do they know millions won't have cancer screenings if planparentobamac cut,1
yes blacks do support romneybecause they care about america's future not one man's ego,1
why does the media avoid showing romney's crowds just like ron paul's crowds now lol tcot,0
president clinton explains mitt romney's 5 trillion tax cut via,0
isn't a good choice for this country either the 'lesser evil' approach cont,-1
nato a closer look at mitt romney's speech was a confused candidate trying to paint himself as leader via,-1
mitt romney's bain helped philip morris get us high schoolers hooked on cigarettes,-1
romney closing in on obama in pa quinnipiac poll finds; caseysmith senate race too close to call,0
it's official on nov 6 it's obamabidenwarren vs romneyryanbrown who's on your side mapoli masen,0
3 weeks from today we choose between a fair society or a selfappointed aristocracy led by lord &amp; lady romney no hyperbole here ctl tcot,-1
mitt romney's bain helped philip morris get us high schoolers hooked on cigarettes,-1
romney is a mean bully at homehateful thing to do to your sonsgrandchildrenmitt ugly thru &amp; thru,-1
i don't know about gary but i do know who romney &amp; obama r &amp; th enough 4 me 2 write in ron paul,0
america votes on the most likable candidate the one u can drink a beer with clinton bush &amp; obama have swag,0
oneworldorder rupert murdoch barker for mitt romney step right up folks see the greatest show on earth jesustweeters tcot tworship,1
president clinton explains how mitt romney is planning huge tax breaks for millionaires via,0
that is propaganda he will dump onromney like a garbage truck emptying its contents at the town hall meeting,-1
secret debate contract reveals obama &amp; romney campaigns exclude 3rd parties control questions debates,0
pa is to obama what fl is to romney neither can realistically win without them tonight could change everything again,0
romney cant connect with anyone kids may be too honest for him,-1
read memo from romney political director rich beeson where things stand in the buckeye state,0
wow losing much dnc creates fake romney campaign website giving 'details' of gop tax plan tcot,-1
rupert murdoch sells you bibles religious books also biggest pornography seller now sells romney jesustweeters tcot tworship,0
new poll shows romney losing ground with latinos so much for self deportation,-1
and then ann romney can whine on the view that obama twisted mitt's words against him,-1
nyt a romneyryan victory could result in recriminalizing abortion in much of the united states,0
yea i can't think of one time i've heard romney mention his religion either,0
lmfao saw a white old man i screamed out the window like stop mitt romney ha,0
oh lawd i hope mitt stays a step ahead biden was weird,1
romney is a con man the media is sheltering him in the interest of making this a close race,1
rt if you want obama to civil rights uppercut romneyif he does that damn smirk tonight lmao,0
beloved sisters &amp; brothers of massachusetts we are ready to share what you know about gov romney,0
wish biden was showing up for the town hall debate tonight romney needs to be laughed at too,-1
mitt romney's a republican; that says it all,-1
women gop mitt romney does not support your right to get equal wages for equal work &amp; that is your economy &amp; also your retirement no mitt,-1
romney created new fees doubled court filing fees professional regulations marriage licenses &amp; firearm licenses,-1
president clinton explains mitt romney's 5 trillion tax cut election2012,-1
i have faith that you will make it america needs you we are screwed with romney he just doesn't care enough for us,-1
romney invested in medical waste co,-1
looks like and had a slumber party last night they were tweeting about obama at the same time catty,0
more interested in obama winning so he has a chance to take further action on climate if romney wins we're cooked literally,0
with answer to debate question; add do any of you believe it was fog of war and not a fog of lies romney2012 romney romneyryan2012,1
as gov romney didn't work with dems over 800 vetoes that is his record,0
mrpresident call out romney on his lies&gt; save our country frm this flipfloppin liar,-1
rt so now we know what happens when the phone rings at 3 am in the white house obama call forwards to hillary,0
yes p2 is mitt romney mentally ill via,-1
if romney wins im moving to india literally same,-1
pres obama campaign president clinton explains gov romneys 5 trillion tax cuta below is the press release from,0
in ma ppl see mitt romney has a fraud and political prostitute so robert is clueless msnbc jansingco,-1
women second look on romneyu got 2 be kidding romney is not what he said in debatemitt romney is what he ran on be4 debate about women,0
if romney wins the presidential election the worlds really ending this year,-1
obama &amp; romney have agreed upon hilarious debate rules to protect themselves from interacting wreal people,-1
romney would have to deal with the enormous mess o leaves behind and then get blamed for it by the left right,1
why romney and ryans 'reforms' of medicaid would likely destroy it the nation,-1
poll romney hits 50 percent holds 4point national lead prettyfuckngscary,1
i think this will be more even but romney will still lead the polls,1
rt mitt romney says he was too important to go to the vietnam war what a jerk army marines seals,-1
romney's jobs plan,0
there is no 5 trillion dollar tax cut mitt romney pretty much his main point at the debate,1
romney may screw up tonight he is never more than awkward when he has to talk to those pesky real ppl in the lower 47,-1
yo twitter telln yall straight upi am going to be fucking up tonight i shall be wielding my twitter bat itz on mitty,0
romney record of vito's and the number of the ds over riding his vito show anything but he worked with both parties,0
romney jobs plan designed by bush team that created zero jobs washington post they've done it again,-1
as mass gov romney privatized an elevator at the state house so he wouldn't have to ride with those across the aisle,-1
it's called venting fear of romney winning maybe they feel better now,-1
taibbi romney ryan tax plan 'should be slaughtered by the press',-1
wow talk about a surge for romney not only is nevada crucially a tossup again but ohio &amp; even wisconsin &amp; pennsylvania,1
romney had 800 vetoes overriden in ma legislature hardly a bipartisan record 29 approval leaving office,1
rt read memo from romney political director rich beeson where things stand in the buckeye state,0
on romney on lie there are peopleprobably including robert moses who have fantasized about such smooth sailing for years,0
romneys jobs plan revealed to be flimflam,0
romney will harvest all of us,0
koch brothers encourage employees to vote romney ows osf ola oo nyc,1
if mitt romneywins the election i'll be moving to the netherlands lol,-1
gives romney 4 pinocchios for bogus math in claim he'll produce 12 million jobs hash with no meat,-1
huge wapo says romney's 12 million jobs plan is entirely bogus pinnochios maxed out via,-1
sheldon adelson is a major gopromney contributor under investigation for china business dealing why no discussion reporting,-1
the bear's lair foreign policy in a bad world mitt romney's foreign policy agenda would lead to permanently h,0
rt no difference frompbo yes sensata republican consultant robert traynham says on msnbc that romney has a moderate record,0
why not lol rt if mit romney win i'm leaving the usa no you're not,-1
and romney foreign policy advisors got us into two extended expensive wasteful wars that squandered the peace dividend,-1
rt another day another solyndra like romney said obama only seems to pick losers,0
heh the romney tax plan fb,0
romney's policies were rejected by the legislature in mass he veto minimum wage and vets increases romneyhood,-1
looks under the hood of romney's promise of 12mm jobs spoiler alert it doesn't add up,-1
looks under the hood of romney's promise of 12mm jobs spoiler alert it doesn't add up,-1
prepping for the debate tonight get romney tax plan details here,0
your house is covered in romney postersi'm really glad you could show me how ignorant you are so i can avoid you at all costs,-1
romney should be called mr vanilla because vanilla questions are the only ones he can answer he shld be on fox,0
wish i was home to go see mitt tomorrow mittsthetits romney2012,0
of tax return didn't buy mitt a vp spot year a biz guru was needed he won't reveal tax returns &amp; wants to be ceo,0
women love ann romney tcot,1
mitt romney style,0
this guy is funny does he really believe our foreign allies like romney after that disastrous trip earlier this year,-1
jim talent again think he will be honest about romneyno romney did not lay out detail just statements no details,0
this please share with all friends florida women for romney rally via,0
romney's tax plan doesn't add up but does it deserve a second look,0
blasts airheaded actresses in new proobama ad that warns women about a romney presidency,-1
matt taibbi 'romneyryan tax plan still makes no sense',-1
praying that tonight governor romney will be amazing and the american people will see the true colors of our president,1
regarding romney foreign policy we saw it at olympics and mideast trip that worked well didn't it,-1
idk who put the romney sign outside the neighborhood but not all of us are romney followers nowaygirlfriend,0
snd i'm guessing the flip side is if romney wins don't be surprised if i lat you off,-1
rt today's absolute mustread mitt romneys new math for jobs plan doesnt add up,-1
wonder how many american latinos know founder of univison jerry perenchio gave 26 mil supporting amer crossroads pacrove 4 romney,-1
romney jobs plan designed by bush team that created zero jobs washington post they've done it again,0
i watching the debate tonight just to see romney lie more and watch a lot of dumb americans buy into his sales pitch vs substance facts,-1
mitt romney is the american horror story,-1
whoopi goldberg fires back at mitt romney over leaked comments via,-1
i don't believe anything is free it has to be paid for some how i would respect romneyryan if they present a blueprint showing what they,0
i love my country which is exactly why i'm not voting for romney,-1
rt sounds fun in 1965 mitt romney was arrested for using large blocks of ice to slide down the slopes of a golf course,0
whoa romney's top economic adviser glenn hubbard acknowledges romney is making s up on jobs ncpol copols,-1
tell that romney said if he tells what cuts he will make he will lose,-1
check out the new fck romney shirtgets more people talking they sell em at,-1
everything about sociopath romney is flimflam he's a con artist,-1
why do women turn for romneyryan don't they see that they are wolfs in sheeps clothes,-1
'erratic and startling' aide to george romney blasts mitt's campaign tactics via,-1
mitt romney against women rights maybe he ain't such a bad guy after all lol stillfunny,-1
facts when it comes to his 5t tax plan don't let mitt romney give you the runaround details matter,-1
if you're looking for a defense of the romney tax plan that is in touch with reality this is a good one,1
rt hahahahaha &lt;3 breaking details on romney's tax plan finally revealed p2 topprog obama2012,0
gary johnson is pulling votes from romney you cannot take votes from from romney when they weren't his votes to begin with,-1
jim talent earnestly trying to sell romney on strength of his tax plan and making the world fall in love with america again fail,1
why should hammer obama on shale gas in pa winningissue energy,0
excellent explanation president clinton explains how mitt romney is planning huge tax breaks for millionaires [video],-1
paul ryan washing already clean dishes to fool america represents the romneyryan ticket fake and phoney to it's core,-1
damn whenever a dlist has been attention starver wants some free press they seem to claim romney as their choice candidate,0
president clinton explains mitt romney's 5 trillion tax cut election2012,0
won't change mine rt if romney wins popular vote but loses electoral will that change gop minds about electoral college,0
going to hofstra to throw coins at mitt romneyhe'll probably wonder what those strange little metal things are,-1
would you really want a man in the white house who honestly believes he can become a god romney believes that,-1
would be nice if called out his guests on dancing around his questions just once romney kids did it all night,0
newest details on romney tax plan,0
the gap among female voters is closing tcot,0
another tv filled night yankees playoffs debate romney,0
finally a detailed explanation of how the romneyryan tax plan works,0
stephanie cutter mitt romney blatantly distorting the president's record via,-1
romney transfers funds to state party committees news p2,1
the romney myth is not supported by math facts or even partial truths,-1
as i like you normally i'd wish you luck tonight instead i wish america luck go romney,1
this is a growing story predebate romney ignores workers as story gains coverage,-1
alex jones leaked debate agreement shows both obama and romney are sniveling cowards,-1
mitt is going to choke this fool out tonight guaranteed abortionantigod party in deaththroes tonight,1
5 things to watch for when obamae romney meet in town hall style 2nd debate election2012 271debate,0
look at msnbc trying to help romney by giving him answers to simple question its shameful romney didn't know minwage,-1
i have not seen romneyryan explain in detail to voters how good managers set goals objectives and programs follow up to completion,0
depends on what romney can achieve with waivers executive orders and bipartisan dislike of some elements,1
team romney all the way,1
[news]romney raises record 170 million,1
if rnc was a company why would one hire it romney likes to fire; why hire a bad company that handed 6t debt to obama,-1
patton oswalt has some debate tips for mitt romney,0
do we really want to reelect obama who blames bush or calls romney a liar for all his failures as a president selfdeception is limitless,-1
pres clinton explains mitt romney's 5 trillion tax cuts romney's math doesn't add up,-1
women for mitt &amp; juntos con romney conference call wann &amp; craig romney mitt romney for president,1
rt ayo stop playing with that jive ass turkey mitt romney and get right at him tonight man,1
why did mitt romney pick paul ryan for vice president see for yourself,0
health care petroleum lobbyists help romney raise 9 million via source2012,0
mitt romney's jobs plan math is as bogus as his tax plan math p2,-1
romney's leading 31 according to my bike ride survey of yard signs in my neighborhood in florida romneyryan2012,1
mitt romney's tax dodge via,-1
liar like romney can onlyb thought of as winning a debate ifu rename it a lying contest facts matter 4any1 not a foolpundit,0
jansing must get paid a lot of money to sell her career down the drain for mitt romney the habitual liar,-1
why mitt romney's 12 million jobs math is rejected by the fact checkers,-1
oh i see they have romney lower in ohio and higher in va making the difference larger in oh but ppp poll is a joke,0
you can vote for romney and still be a democrat no one has to know,1
you want romney to win setup a donation campaign for him on our site to help,-1
you leave president romney &amp; the 1st 2nd 3rd and 4th ladies out of this,0
if this nation elects mr romney a disingenuous chameleon president what does that say about us as a nation,-1
it's all about america &amp; its opportunity to begin a true resurrection romneyryan can place america on those first required steps,1
why didn't mitt romney run for a second term as governor he would have miserably lost romneyshambles,-1
you would think romney's entire economic policy being a sham would be a story,-1
you would think romney's entire economic policy being a sham would be a story,-1
